{
  "$schema": "../../../schemas/task-packet.schema.json",
  "schemaVersion": "1.0.0",
  "taskId": "SUT-AIOS-P1-004",
  "title": "Define deterministic authorization policies",
  "status": "done",
  "phase": "phase-1",
  "workstream": "policy-definitions",
  "workflowId": "implementation-p1-004",
  "playbookId": null,
  "playbookMode": "shadow",
  "businessObjective": "Advance Phase 1 — Trusted control foundation through one bounded policy-definitions outcome.",
  "technicalObjective": "Create the version 1 static authorization-policy artifact and deterministic offline validator exactly as defined in docs/policy-definitions/DETERMINISTIC_AUTHORIZATION_POLICIES.md.",
  "architectureReferences": [
    "docs/architecture/source/Sri U-Thong Grand Hotel AI OS.md",
    "docs/architecture/source/Agent Architecture.md",
    "docs/policy-definitions/DETERMINISTIC_AUTHORIZATION_POLICIES.md",
    "docs/project/IMPLEMENTATION_BACKLOG.md"
  ],
  "dependencies": [
    "SUT-AIOS-P1-001",
    "SUT-AIOS-P1-003"
  ],
  "evidence": [
    "evidence/tasks/SUT-AIOS-P1-004/verification.md"
  ],
  "assumptions": [
    "No production write, deployment, live credential access, database access, migration execution, RLS, queue, or external service access is authorized.",
    "The contract and validator are static repository artifacts; the validator uses Node built-ins only and must not install packages.",
    "Interfaces with the finalized platform use approved compatibility contracts only."
  ],
  "acceptanceCriteria": [
    "policies/deterministic-authorization-policies-v1.json implements the closed version 1 authorization policy design specified in docs/policy-definitions/DETERMINISTIC_AUTHORIZATION_POLICIES.md.",
    "tests/policy-definitions/validate-authorization-policies.mjs deterministically accepts the finite valid artifact and rejects every documented invalid case without network or external state.",
    "The exact validator command and fast governance verification pass, and independent verification confirms forbidden paths were untouched."
  ],
  "allowedPaths": [
    "policies/**",
    "tests/policy-definitions/**",
    "docs/policy-definitions/**",
    "evidence/tasks/SUT-AIOS-P1-004/**",
    "evidence/verification/SUT-AIOS-P1-004/**",
    "tasks/**/SUT-AIOS-P1-004/**"
  ],
  "forbiddenPaths": [
    "reference/finalized-platform/**",
    "docs/architecture/source/**",
    ".env*",
    "**/*secret*",
    "**/*credential*",
    "supabase/**",
    "migrations/**",
    "apps/**"
  ],
  "allowedCommands": [
    "node tests/policy-definitions/validate-authorization-policies.mjs",
    "npm run verify:fast",
    "git diff --check"
  ],
  "requiredChecks": [
    "policy-definitions contract validation",
    "changed-path inspection",
    "secret scan",
    "independent verification",
    "independent machine verification"
  ],
  "requiredTests": [
    "node tests/policy-definitions/validate-authorization-policies.mjs",
    "npm run verify:fast"
  ],
  "productionWritePermission": false,
  "pullRequestRequirement": true,
  "riskLevel": "high",
  "autonomyTier": "tier-0",
  "defaultAgent": "codex-engineering-executor",
  "allowedAgents": [
    "codex-engineering-executor",
    "qa-verification"
  ],
  "modelRoute": "sol",
  "defaultModel": "gpt-5.6-sol",
  "fallbackModel": "gpt-5.6-sol",
  "workspaceWrite": true,
  "solEscalationTriggers": [
    "Any required change crosses declared subsystem or protected paths.",
    "Any production access, credential, payment, booking, RLS, migration, authorization, concurrency, or workflow-correctness ambiguity arises."
  ],
  "rollbackExpectations": "Revert the static policy contract, validator, task-state record, and evidence together; preserve audit and verification evidence.",
  "outputSchema": "schemas/agent-result.schema.json",
  "contextBudget": {
    "maxBytes": 262144,
    "includedPaths": [
      "AGENTS.md",
      "tasks/done/SUT-AIOS-P1-004/task.json",
      "docs/policy-definitions/DETERMINISTIC_AUTHORIZATION_POLICIES.md",
      "docs/project/IMPLEMENTATION_BACKLOG.md"
    ]
  },
  "owner": "codex-engineering-executor",
  "reviewer": "qa-verification",
  "createdDate": "2026-07-26T13:10:00.000Z",
  "updatedDate": "2026-07-27T15:46:22.842Z",
  "completionEvidence": [
    "evidence/tasks/SUT-AIOS-P1-004/verification.md"
  ],
  "stateTransitions": [
    {
      "from": null,
      "to": "backlog",
      "at": "2026-07-26T13:10:00.000Z",
      "actor": "engineering-planner",
      "reason": "Generated from canonical phased implementation backlog."
    },
    {
      "from": "backlog",
      "to": "ready",
      "at": "2026-07-27T15:43:16.228Z",
      "actor": "codex-engineering-executor",
      "reason": "Dependencies P1-001 and P1-003 are satisfied"
    },
    {
      "from": "ready",
      "to": "active",
      "at": "2026-07-27T15:45:49.800Z",
      "actor": "codex-engineering-executor",
      "reason": "Scope and checks approved, starting implementation of P1-004 deterministic authorization policies"
    },
    {
      "from": "active",
      "to": "review",
      "at": "2026-07-27T15:46:17.324Z",
      "actor": "codex-engineering-executor",
      "reason": "Implementation submitted for independent QA review"
    },
    {
      "from": "review",
      "to": "verified",
      "at": "2026-07-27T15:46:20.235Z",
      "actor": "qa-verification",
      "reason": "Independent QA review and deterministic machine verification passed"
    },
    {
      "from": "verified",
      "to": "done",
      "at": "2026-07-27T15:46:22.842Z",
      "actor": "qa-verification",
      "reason": "Completed static deterministic authorization policies definition"
    }
  ]
}
