{
  "$schema": "../../../schemas/task-packet.schema.json",
  "schemaVersion": "1.0.0",
  "taskId": "SUT-AIOS-P0-003",
  "title": "Capture finalized-platform compatibility contracts",
  "status": "ready",
  "phase": "phase-0",
  "workstream": "compatibility",
  "workflowId": "implementation-p0-003",
  "playbookId": null,
  "playbookMode": "shadow",
  "businessObjective": "Advance Phase 0 — Existing platform stabilization through one bounded compatibility outcome.",
  "technicalObjective": "Capture finalized-platform compatibility contracts",
  "architectureReferences": [
    "docs/architecture/source/Sri U-Thong Grand Hotel AI OS.md",
    "docs/architecture/source/Agent Architecture.md",
    "docs/project/IMPLEMENTATION_BACKLOG.md"
  ],
  "dependencies": [
    "SUT-AIOS-P0-001"
  ],
  "evidence": [
    "evidence/tasks/SUT-AIOS-P0-003/verification.md"
  ],
  "assumptions": [
    "No production write, deployment, or live credential access is authorized.",
    "Interfaces with the finalized platform use approved compatibility contracts only."
  ],
  "acceptanceCriteria": [
    "Capture finalized-platform compatibility contracts is implemented only within the declared subsystem.",
    "Machine-readable contracts and deterministic failure behavior are documented.",
    "Required tests pass and independent verification confirms forbidden paths were untouched."
  ],
  "allowedPaths": [
    "packages/compatibility-contracts/**",
    "tests/compatibility/**",
    "docs/compatibility/**",
    "evidence/tasks/SUT-AIOS-P0-003/**",
    "tasks/**/SUT-AIOS-P0-003/**"
  ],
  "forbiddenPaths": [
    "reference/finalized-platform/**",
    "docs/architecture/source/**",
    ".env*",
    "**/*secret*",
    "**/*credential*",
    "supabase/migrations/**",
    "apps/ibe/src/payments/**",
    "apps/ibe/src/inventory/**"
  ],
  "allowedCommands": [
    "npm run test:contracts",
    "npm run verify:fast",
    "git diff --check"
  ],
  "requiredChecks": [
    "compatibility contract validation",
    "changed-path inspection",
    "secret scan",
    "independent verification"
  ],
  "requiredTests": [
    "npm run test:contracts",
    "npm run verify:fast"
  ],
  "productionWritePermission": false,
  "pullRequestRequirement": true,
  "riskLevel": "medium",
  "autonomyTier": "tier-0",
  "defaultAgent": "codex-engineering-executor",
  "allowedAgents": [
    "codex-engineering-executor",
    "qa-verification"
  ],
  "modelRoute": "terra",
  "defaultModel": "gpt-5.6-terra",
  "fallbackModel": "gpt-5.6-sol",
  "workspaceWrite": true,
  "solEscalationTriggers": [
    "Any required change crosses declared subsystem or protected paths.",
    "Any production access, credential, payment, booking, RLS, migration, authorization, concurrency, or workflow-correctness ambiguity arises."
  ],
  "rollbackExpectations": "Revert the compatibility branch and generated artifacts; preserve audit and verification evidence.",
  "outputSchema": "schemas/agent-result.schema.json",
  "contextBudget": {
    "maxBytes": 262144,
    "includedPaths": [
      "AGENTS.md",
      "tasks/ready/SUT-AIOS-P0-003/task.json",
      "docs/project/IMPLEMENTATION_BACKLOG.md"
    ]
  },
  "owner": "codex-engineering-executor",
  "reviewer": "qa-verification",
  "createdDate": "2026-07-26T13:10:00.000Z",
  "updatedDate": "2026-07-26T14:18:29.550Z",
  "completionEvidence": [],
  "stateTransitions": [
    {
      "from": null,
      "to": "backlog",
      "at": "2026-07-26T13:10:00.000Z",
      "actor": "engineering-planner",
      "reason": "Generated from canonical phased implementation backlog."
    },
    {
      "from": "backlog",
      "to": "ready",
      "at": "2026-07-26T14:18:29.550Z",
      "actor": "engineering-planner",
      "reason": "P0-001 is done with durable independent verification; sole dependency satisfied."
    }
  ]
}
